,key_skills,name,id,description,salary,creation_time,employer,schedule,accept_temporary
0,"Английский — B2 — Средне-продвинутый, Информационные технологии, Разработка компьютерных Игр",Программист-разработчик игр (Middle),51540867,"Мы расширяем свою gamedev-команду и ищем заинтересованных программистов дляразработки компьютерных игр под различные платформы на нашем собственномязыке.**У нас вы получите возможность** :  \- приобрести солидный и разносторонний опыт, решая весь спектр задач посозданию компьютерных игр  \- работать в сильной команде над уникальными продуктами, которыми можногордиться  \- изучать новые технологии и расти как специалист  \- участвовать в полном цикле разработки и предлагать любые улучшения  \- получать справедливую оплату, соразмерную вашему вкладу**Нам важно, чтобы вы** :  \- имели твёрдые фундаментальные знания математики и информационных технологий  \- имели реальный опыт программирования на языке C, C++ или Rust (не в учебныхпроектах)  \- имели опыт программирования для GPU (работы с шейдерами)  \- знали основные сетевые технологии и протоколы  \- умели работать с системами контроля версий и ишью-трекерами  \- понимали, во что превращается ваш код, и как он работает на низком уровне  \- не боялись сложностей и получали удовольствие от решения нестандартныхзадач**Мы обрадуемся** , если вы также имеете опыт/навыки работы с Unix, Android,web-программированием, базами данных.У нас возможна удалённая работа по любому удобному вам графику.  Оплата производится не за количество проведённых за компьютером часов, а зазавершённые задачи. Все задачи оцениваются перед выполнением.","{'from': 150000, 'to': 300000, 'gross': False, 'currency': 'RUR'}",2022-01-22T16:02:33.725+03:00,ГравиЛинк,FLEXIBLE,False
1,"Английский — B1 — Средний, Rust, APIs",Rust Developer,51331781,"Кто мы?Мы - партнёры западно-европейской компании, разрабатывающей инновационноекомплексное решение для управления трафиком грузовых и пассажирских дронов вгородских условиях. Вам предстоит разрабатывать систему для построениямаршрутов и автоматического управления беспилотными летательными аппаратами вгороде.Почему мы?\- Наша молодая, но уже опытная компания разрабатывает решение совместно сведущими мировыми авиастроительными концернами и производителями автомобилей\- Разрабатываемое решение находится на пике технологий как по архитектуре,так и по стеку\- Разнообразная команда из разных стран Мира, включающая в себя от студентовдо главных инженеров и менеджеров из таких индустрий как авиастроение,телеком, разработка ПО\- Более чем адекватное руководство и отличная рабочая атмосфера\- Возможность улучшить английский язык\- Удалённая работа с относительно свободным графиком - мы ценим прежде всегорезультат\- Достойная рыночная оплата трудаКого мы ищем?Опытных middle/senior Rust-разработчиков для удаленной работы в русско-немецкой команде.**Что мы ждем от Вас:**— Желателен опыт разработки на Rust от 2х лет  — Разговорный английский (Intermediate+)Будет плюсом:\- Опыт разработки APIs  \- Опыт программирования для встраиваемых систем  \- Общие познания в физике, теории управления  \- Интерес к авиации, дронам","{'from': 150000, 'to': 250000, 'gross': True, 'currency': 'RUR'}",2022-01-19T12:13:57.555+03:00,Тихменев Дмитрий Ярославович,REMOTE,False
2,"Blockchain, Rust, DeFi, NEAR Protocol, DEX, Order book",Lead/Senior/Middle Rust Developer,50789953,"Algalon Capital is looking to hire a Lead/Senior/Middle Rust Developer(https://spin.fi).**About Spin:**Spin is a multichain DEX that makes decentralized crypto futures and optionstrading more efficient by providing traders with advanced risk management andstrategy-building tools, as well as a superior Central Limit Order Bookexecution model. The first blockchain to be supported is NEAR Protocol.The team behind the project has experience in algorithmic trading and buildingproducts, including blockchain tech-based.We are a passionate group of hardworking and fun individuals spread out allover the world, working to build the initial core products of Spin Financewhile striving for decentralization.The project is supported by Tier 1 crypto VC and market makers.**Responsibilities:**  * Work together in a senior team  * Pitch your ideas regarding (technical) design  * Sync with NEAR developers building other things in the space**Requirements:**  * 3+ years of experience as a software engineer  * Strong proficiency in Rust, C++, or Golang (or other systems language)  * Extensive knowledge of virtual machines or blockchain node software  * Ability to design, research, and develop blockchain-based solutions  * Excellent communication skills**Nice to Have:**  * Experience with blockchain protocols, whether it be the usage of a blockchain API, knowledge of how a blockchain operates, or any other experience  * Experience with distributed systems, peer-to-peer systems, network programming, and cryptography  * Experience writing software from a technical specification or a reference implementation  * Experience maintaining a large codebase with many components and keeping it well-designed, future-proofed, and modular  * Experience with documenting a large codebase, both for internal and user-facing components  * Familiarity with open-source software principles**Location:**This is a full-time position that is 100% remote or in the office in MoscowCity.Please apply with a link to your GitHub repo.","{'from': 4000, 'to': 12000, 'gross': False, 'currency': 'USD'}",2022-01-04T10:01:05.352+03:00,Algalon Capital,FULL_DAY,False
3,"Java, C++, Blockchain",Rust разработчик (Middle),52075025,"В **Equilibrium Lab** мы разрабатываем высокотехнологичные DeFi приложения:закрываем потребности наших клиентов в области децентрализованных финансов.Нашими продуктами пользуются более **2500** пользователей по всему миру.**Обязанности:**  * Разработка нового / поддержка текущего функционала De-Fi блокчейна на базе технологии Substrate на языке Rust  * Доработка системы интеграционного тестирования блокчейна на языке Rust  * Разработка вспомогательных сервисов (в том числе и высоконагруженных) на языках Rust и .NET**Требования:**  * Опыт разработки на Rust (можно пет проекты)  * Опыт разработки на одном из языков (.NET, Java, C++) более 3-х лет  * Опыт разработки продуктов, вышедших в продакшн  * Знание и понимание шаблонов проектирования  * Интерес к децентрализованным технологиям**Будет плюсом:**  * Опыт в криптографии",,2022-02-03T14:10:29.106+03:00,Equilibrium Labs,FULL_DAY,False
4,,Middle Python Engineer в команду Hokage,50641451,"**Привет! Я Илья, оверлорд всея бэкенда команды Hokage, и я ищу в свою командуамбициозного и самостоятельного Middle Python Engineer**    В разных проектах Haiku собрались ребята, которые мыслят продуктово, и мызагорелись идеей запустить и протестировать десятки собственных проектов вближайшие 3 года в поисках успешного стартапа.**Команда Хокаге** сейчас реализует проект в сфере креативной экономики инастраивает рельсы венчур билдера. Уже запущено приложение Reach Me: визиткадля контент-мейкеров с оплатой разного контента на месте. Среди первых задачбудет: придумать алгоритм классификации для автоматической генерации mock APIсервера, реализовать общий механизм для санации пользовательского ввода в API,а также придумать общий механизм для выполнения миграций данных на уровнеприложения. И чтобы решить эти вопросы, мы ищем в команду еще 1 бэкенд-инженера***В тебе я хочу видеть:**  * Знание проектирования сервисов. Мы практикуем DDD, используем C4 для визуализации архитектуры, OpenAPI для планирования и разработки API;  * Успешные кейсы разработки сервисов на Python, у нас FastAPI со всеми преимуществами async/await;  * Опыт работы с реляционными СУБД. Буднично нам хватает Tortoise ORM, но миграции/оптимизации пишем на чистом SQL под PostgreSQL;  * Любовь к качеству и продуктивности работы. Мы используем behave и BDD нотацию для тестирования сценариев использования сервиса;  * Опыт виртуализации решений. Kubernetes на окружениях, деплой через Helm, Docker используется даже как CLI, никаких make-файлов и батничков;  * Работу на Актуальном техническом стеке. Изначально планировался Django =) Но сейчас мы рассматриваем только современные и эффективные технологии;  * Желание развивать кругозор. На нашем техническом радаре мелькает Rust и планируется Go для отдельных сервисов.*Мы понимаем опыт бекенд-разработки в широком смысле слова. Смена профиля на Python и опыт разработки на JavaScript/Java/C# в прошлом для нас только плюс. Если любишь аниме — ещё лучше:)**У нас:**  * Удалённая работа, гибкий график;  * 28 дней отпуска в год + 3 дополнительных дня отдыха в квартал;  * Корпоративные скидки от BestBenefits, подписка на аниме-стриминг сервис;  * Возможность протестировать свои идеи для стартапа ;)",,2021-12-22T17:33:08.445+03:00,Haiku Dev,REMOTE,False
5,"Linux, Rust, OOP",Middle/Senior Rust developer,51062808,"В связи с активным ростом команды находимся в поиске **_Middle/Senior Rustdeveloper_.**Мы сами выбираем стек технологий, который лучше подходит к нашим проектам иусловиям. Разработка ведется с нуля, отсутствует многолетний legacy код.**Требуемые навыки:**  * Владение языком rust или желание его освоить;  * Опыт работы с различными базами данных;  * Умение писать тестируемый код;  * Уверенное владение ОС Linux;  * Самостоятельность, аккуратность и ответственность;  * Умение находить простые решения для сложных задач;  **Предстоящие задачи:**Реализация распределенного объектного хранилища для предоставлениямасштабируемого хранилища объектов под различные задачи.Цель: предоставить масштабируемое хранилище объектов для различных задач.Есть множество данных, которые требуется хранить и отдавать пользователю,например статические изображения товаров от поставщиков и пользователей.По некоторым причинам нас не устраивают готовые решения, поэтому возникланеобходимость разработать свое. Ключевые требования к системе:  * Справляться с нагрузками в 500 000 RPS на чтение.  * Для начала 1 000 000 000 объектов.  * Максимальный размер объекта - 2 Mb.  * Обеспечить консистентность данных на запись.  * Простое горизонтальное масштабирование.  * Максимальная простота системы и минимум зависимостей.  * Возможность запускаться как в Kubernetes, так и на ""голом железе"".**Мы предлагаем:**  * Возможность гибкого начала рабочего дня, полностью удаленная занятость.  * Возможность оформления по ТК РФ или по договору с ГПХ, с самозанятым или ИП.  * Достойное вознаграждение: «в рынке» и даже чуть интереснее.  * Преимущественно новые проекты без поддержки старого ĸода.  * Интересные и амбициозные задачи, дающие ощущение причастности к значимому делу, которым можно гордиться.  * Возможность непосредственно влиять на создание и развитие продукта.  * Действительно отличную команду, с которой можно обсудить идеи и осуществить наиболее удачные из них.  * Возможность сильно прокачаться в процессе реализации смелых идей, идущих на пользу проектам: большое поле возможностей и экспериментов.",,2022-01-13T22:12:00.280+03:00,WILDBERRIES,REMOTE,False
6,"React, TypeScript",Frontend разработчик React (Middle/Senior),51273962,"Привет! Мы - активно растущая компания, разрабатываем свои собственныепродукты в области информационной безопасности, которые позволяют нашимклиентам автоматизировать управление ИБ, а также производить мониторинг иреагирование на инциденты.Наши продукты используют более 100 клиентов в России и странах СНГ. Среди них:ВТБ, Альфа-Банк, Россельхозбанк, РЖД, Газпромнефть, Ростелеком, СТС-Медиа идругие крупные компании.**Сейчас мы ищем React-разработчика в одну из продуктовых команд.****R-Vision Threat Intelligence Platform (TIP)** представляет собойспециализированную платформу управления данными киберразведки. Платформаобеспечивает автоматический сбор, нормализацию и обогащение индикаторовкомпрометации, передачу обработанных данных напрямую на внутренние средствазащиты, а также поиск и обнаружение индикаторов в инфраструктуре организации спомощью сенсоров.**Какие задачи?**Главная задача: развивать фронтенд направление продукта. Строить сложнуювизуализацию, решать технические задачи, используя весь свой творческий идевелоперский потенциал.В данный момент ищем тимлида в команд. При наличие желания есть возможностьразвиваться в данном направлении.Мы не поддерживаем IE и используем современные API.У нас есть свой UI Kit, которым занимается команда из разработчиков разныхпродуктовых направлений, при желании можно принимать участие в его разработке.**Какой стек?**Frontend:  React/Redux, TypeScript, SCSS/StyledComponentsBackend:  Docker  Node.js/TypeScript, Rust, PostgreSQL, Rocksdb, ClickHouseПри желании можно работать фуллстеком.**Если кратко, мы ждем от тебя что ты:**  * Разбираешься в React и его экосистеме.  * Умеешь проектировать UI/UX.  * имеешь свое мнение и можешь аргументированно объяснять свои идеи.**Будет большим плюсом, если ты:**  * Интересуешься сферой ИБ (атаки, сети, решения и т.д.).  * Владеешь английским языком на уровне чтения документации.**Какая команда?**В компании все команды независимые, в каждой есть Product Owner, ProjectManager, Аналитики, Разработчики, Тестировщики и Дизайнеры.**Какие процессы?**Работаем по скраму, итерации 2-ух недельные, ретроспективы, дейли митинги исозвоны с неформальным общением.Ведем задачи в Jira, общение в Slack, код храним в GitLab.**Остальное:**  * Работать можно удаленно или в офисе, или совмещать.  Офисы есть в Москве, СПб и Краснодаре.  * График работы 5/2, начало дня по договоренности с лидом команды (в среднем с 10 по Москве).  * Оформление по ТК РФ, отпуска и больничные оплачиваются.  * ДМС после полугода работы.  * Ходим/смотрим конференции, отправляем на необходимые обучения, покупаем умные книжки за счет компании.  * Регулярно проводим вебинары/доклады/мастер-классы внутри компании на интересующие нас темы.  * Пересмотр ЗП 1-2 раза в год по итогам Performance Rewiev",,2022-01-18T15:38:52.567+03:00,Р-Вижн,REMOTE,False
