,key_skills,name,id,description,salary,creation_time,employer,schedule,accept_temporary
15,"Rust, C/C++, Static analysis",Middle/Senior Rust Engineer,51649037,"The products developed by our team are widely used in all enterprise-leveltelecom projects at Huawei to help developers write better code and be moreproductive. Our teams focus on creating effective development tools likestatic analyzers, parsers, bug predictions, language servers and refactoringsolutions for embedded software and Rust programmers. All our components builton the open source technologies such as LLVM/Clang.**Responsibilities:**  * Developing state-of-the-art algorithms in areas of compiler technologies and program analysis;  * Work on Rust IDE;  * Work on symbolic execution and constraint solving interesting and challenging tasks;  * Contribute important bug fixes and patches to the open source community;  * Profile, analyze and optimize the created software;  * Collaborate with internal and external team members to solve complex issues;**Requirements:**  * Experience in Compiler Frontend (Lexer; Parser; Semantic Analyzer; AST parser);  * Knowledge/experience of static analysis;  * Experience in developing algorithms and working with complex data structures;  * Familiar with development tools architecture and design (IDE, toolchain, and debugger);  * Experience with C/C++, Rust;  * Knowledge of object-oriented development and design best practices;**Nice to have:**  * Knowledge of Symbolic Execution is a plus;  * Large-scale open source development;  * Experience with LSP and language servers like clangd will be a plus;  * Developing and maintaining LLVM framework based tools are a plus;",,2022-01-24T16:38:49.247+03:00,HUAWEI,FULL_DAY,False
16,"Английский — A2 — Элементарный, MySQL, Git, Symfony, PHP",PHP разработчик (Symfony php backend developer),51511407,"Ищем Middle/Middle+/Senior backend PHP разработчика в команду RMM. KeeneticRMM это облачное решение для удаленного мониторинга и управленияраспределенными сетями, помогающее малому и среднему бизнесу обеспечиватьбесперебойную круглосуточную работу критически важной инфраструктуры иприложений( подробнее тут rmm.keenetic.com ).    Работа в молодой, сплоченной кросс-функциональной команде с современнымипродуктовыми подходами к разработке.  Если ты хороший бэкенд разработчик, готов расти и развиваться, разделяешь XP иAgile – добро пожаловать!  Если каких-то компетенций или опыта не хватает, то все равно отправляй своерезюме. Возможно, мы сможем организовать тебе программу обучения в процессеработы.     **Задачи:**  ● Современная разработка бэкенд сервисов, служб и API для SPA приложения  ● Развитие и поддержка существующего бэкенд приложения  ● Участие в формировании технологического стека  ● Участие в создании инфраструктуры для высоконагруженного проекта     **Требования:**  ● Опыт работы от 3 лет в роли бэкенд разработчика  ● Знание основ Linux, работы компьютеров и сетевого взаимодействия  ● Знание и понимание модели OSI и в частности HTTP  ● Знание и соблюдение принципов ООП, в том числе SOLID, DRY, KISS и в идеалеDDD  ● Знание паттернов проектирования (основных, архитектурных, enterprise,  интеграционных) и умение их применять  ● Понимание и умение работы с контролем версий – GIT  ● Знание и опыт использования PHP7+, Symfony  ● Знание SQL и опыт использование MySQL  ● Знание работы Nginx / LAMP     **Плюсом будет знания:**  ● PHP8  ● RabbitMQ / Kafka  ● ClickHouse / Redis / Memcached / Elasticsearch  ● PHPUnit / Codeception / Behat  ● GoLang / C++ / Rust  ● Знания о репликации, шардинге, балансировке запросов очень пригодятся  ● Понимание принципов асинхронного программирования  ● Понимание и опыт работы с RESTful API, SOAP, JSON RPC 2.0.  ● Большим плюсом будет понимание frontend и в частности TypeScript, Angular,HTML, CSS     **Условия:**  ● Обычная рабочая неделя 5/2  ● Гибкое начало рабочего дня с 9-12  ● Рабочая станция на выбор (Linux, Windows, Mac OS)  ● Режим на выбор – удаленный формат, офис, либо совмещенный график**Дополнительная информация**● Работа в компании, управляемой инженерами  ● Профессиональный рост и обучение  ● Участие в создании крутых продуктов на современных технологиях  ● Дружественная и сплоченная команда  ● Возможность вырасти в тех лидера (архитектора)    * - Отправляя резюме на адрес электронной почты нашей Компании, вы даете согласие Компании на обработку ваших персональных данных в объеме, указанном в резюме.","{'from': 120000, 'to': 200000, 'gross': False, 'currency': 'RUR'}",2022-01-21T20:52:13.930+03:00,"NDM Systems Inc.,Компания",FULL_DAY,False
17,"ASP.NET, JavaScript, .NET Framework, CSS, MS SQL Server, Git, C++, MySQL, MS SQL, HTML, SQL, HTML5, Linux",Backend/frontend разработчик .Net (middle/senior),51494425,"Наша компания работает на рынке Digital-рекламы и видеотехнологий 17 лет.Основное направление разработки — Платформа по обслуживанию видео- и баннернойрекламы Advark - advarkads.com**Advarkads.com** — один из крупнейших проектов в Рунете подобного класса иединственный в сегменте видеорекламы. High-load система имеющая собственнуюсистему статистики и принимающая решения на основе накопленных данных. Сейчаск ней имеется 2 полноценных приложения для пользователей и admin panel дляменеджеров компании, которые постоянно развиваются по мере появления новогофункционала.Компания ведёт непрерывное развитие собственных проектов, для реализациикоторых нужны энергичные, заинтересованные разработчики!Наша компания является резидентом ""Сколково"".**Наш технологический стек**  * backend: NET Framework 4.5, .NET Core (C#), Rust  * frontend: TypeScript (JavaScript), Angular 4+  * работа с данными: MS SQL Server, ClickHouse, Mongodb  * инструменты разработки: MS Visual Studio 2017, Visual Studio Code  * работа с кодом: TFS 2017, GitЭто основной стек технологий, в процессе разработки стек может расширяться.**Чем предстоит заниматься**  * Frontend разработка.  * Backend разработка серверной части, отдельных сервисов и библиотек.  * Участие в проектировании архитектуры решений, анализ требований, анализ производительности.  * Анализ новых технологий, внедрение в продукт.  * Наполнение базы знаний, написание документаций к разрабатываемым модулям, наставничество для новичков.**Какие soft и hard-skills важны для нас**  * Опыт .NET разработки либо разработки на альтернативных технологиях (Java, Ruby, PHP) от 3 лет.  * Опыт разработки frontend с использованием js-фреймворков.  * Опыт работы с БД, проектированием БД.  * Опыт командной разработки.  * Опыт рефакторинга и оптимизации кода, декомпозирования задач.**Будет плюсом:**  * опыт работы или хорошее понимание устройства серверного программного обеспечения;  * опыт написания unit-тестов;  * умение разрабатывать асинхронный код  * понимание устройства SQL- и NoSQL-хранилищ;  * участие в opensource-проектах или наличие собственных проектов.  * знание особенностей работы JS в мобильных браузерах  * знание Vanilla Javascript (ООП, замыкания, контекст, событийная модель);  * понимание модульной архитектуры AMD/CommonJS/ES6 Modules;  * уверенное знание HTML5/CSS3;  * понимание принципов сборки frontend проектов (Gulp/Webpack/etc)  * опыт работы с git;Профиль Github, портфолио, участие в хакатонах или ссылки на ваши собственныепроекты помогут нам по достоинству оценить ваш опыт.**Мы предлагаем**  * Достойная заработная плата, согласно вашей квалификации.  * Отличный офис в БЦ класса А (БЦ ""Атлант"", ул. Ленина) и тихий openspace.  * Чай, кофе, печеньки в офисе, зона отдыха.  * Возможность гибкого начала рабочего дня.  * Разрабатываем собственный продукт мирового класса в области рекламы.  * Актуальный и востребованный опыт разработки high-load системы.  * Интересная и творческая работа, опыт, повышение уровня знаний.  * Дружный коллектив и профессиональная среда.Возможен переезд. Помогаем в релокации.**Условия:**  * понедельник-пятница; полный рабочий день  * испытательный срок от 1-ого месяцаНа данный момент ищем не только full-stack но и отдельно frontend- и backend-разработчиков. Welcome!","{'from': 100000, 'to': 150000, 'gross': False, 'currency': 'RUR'}",2022-01-21T15:17:09.756+03:00,Advark Video Advertising Platform,FLEXIBLE,False
18,"React, TypeScript, GraphQL",Frontend разработчик React,50296858,"Привет! Мы - активно растущая компания, разрабатываем свои собственныепродукты в области информационной безопасности, которые позволяют нашимклиентам автоматизировать управление ИБ, а также производить мониторинг иреагирование на инциденты.Наши продукты используют более 100 клиентов в России и странах СНГ. Среди них:ВТБ, Альфа-Банк, Россельхозбанк, РЖД, Газпромнефть, Ростелеком, СТС-Медиа идругие крупные компании.**Сейчас мы ищем React-разработчика уровня Middle или Senior в одну изпродуктовых команд.**R-Vision Sense - это аналитическая платформа кибербезопасности, в основекоторой лежит объектно-центричный подход к мониторингу безопасности всейинформационной сети.**Какие задачи?**Главная задача: развивать фронтенд направление продукта. Строить сложнуювизуализацию, генерируя запросы на ходу, решать нестандартные /сложныетехнические задачи, используя весь свой творческий и девелоперский потенциал.  Мы отказались от поддержки IE, поэтому писать нужно будет только под modernbrowsers (Chrome, Firefox, Safari).  У нас есть свой UI Kit, которым занимается команда из разработчиков разныхпродуктовых направлений, тебе также предстоит включиться в процесс чтобысделать UI Kit удовлетворяющий требованиям всех продуктов. А затем,подготовить его к выходу в opensource и зарелизить :)**Какой стек?**Frontend:  React v17 (TypeScript), SCSS/StyledComponents, ECharts, Apollo GraphQLBackend:  Docker  Node.js (TypeScript, Nest.js), Rust, Go, Python (Machine Learning)  GraphQL, PostgreSQL, ElasticSearch, ClickHouseПри желании можно работать фуллстеком.**Если кратко, мы ждем от тебя что ты:**  * Разбираешься в React и его экосистеме.  * Умеешь проектировать UI/UX.  * имеешь свое мнение и можешь аргументированно объяснять свои идеи.**Будет большим плюсом, если ты:**  * Интересуешься сферой ИБ (атаки, сети, решения и т.д.).  * Владеешь английским языком на уровне чтения документации.**Какая команда?**В компании все команды независимые, в каждой есть Team Lead, Product Owner,Project Manager, Аналитики, Разработчики, Тестировщики и Дизайнеры. Помимоэтого в компании есть команда DevOps инженеров, которые занимаются настройкойCI/CD и поддержкой инфраструктуры разработки.**Какие процессы?**Работаем по скраму, итерации 2-ух недельные, ретроспективы, дейли митинги исозвоны с неформальным общением.Ведем задачи в Jira, общение в Slack, код храним в GitLab.**Остальное:**  * Работать можно удаленно или в офисе, или совмещать.  Офисы есть в Москве, СПб и Краснодаре.  * График работы 5/2, начало дня по договоренности с лидом команды (в среднем с 10 по Москве).  * Оформление по ТК РФ, отпуска и больничные оплачиваются.  * ДМС после полугода работы.  * Ходим/смотрим конференции, отправляем на необходимые обучения, покупаем умные книжки за счет компании.  * Регулярно проводим вебинары/доклады/мастер-классы внутри компании на интересующие нас темы.  * Пересмотр ЗП 1-2 раза в год по итогам Performance Rewiev",,2021-12-08T12:39:30.581+03:00,Р-Вижн,REMOTE,False
19,"Системное мышление, ORACLE, Разработка ПО, MS SQL Server, Базы данных, SQL, Oracle DB, Oracle Pl/SQL, Java",PL/SQL developer middle,51030161,"**iFellow** – ИТ компания нового поколения, предлагающая сервисно-ориентированный подход к разработке ПО, тестированию и сопровождениюинформационных систем для бизнеса. Компания iFellow объединила в себе лучшиероссийские практики и передовой зарубежный опыт реализации проектов любойсложности для развития информационных технологий и бизнес-процессов.**iFellow** работает на ИТ рынке с 2015 года. Начиная с 2018 года, основнойспециализацией компании стало направление комплексной системной интеграции иразработка программного обеспечения. Сегодня компания предлагает целый рядинновационных решений для финансовых, страховых и телекоммуникационныхкомпаний, грузовой и пассажирской авиации, нефтегазовой отрасли, сельскогохозяйства, а также ритейла и логистики.На текущий момент мы расширяем нашу команду и будем рады принять в наш дружныйколлектив **PL/SQL разработчика.    О проекте: **Разработка back-офисной АС для обслуживания договоров покредитным картам. Работа над нашим проектом требует креативности и умениярешать нетривиальные задачи, что делает работу над нашими задачами интересной,с большим количеством вызовов. Мы открыты к предложениям, готовы использоватьновые технологии. Ценим полезную обратную связь и готовы дорабатывать нашиусловия труда. У нас есть регулярные встречи разработчиков, на которых мыобсуждаем и решаем все вопросы.**Твои задачи:**  * Разработка новой функциональности;  * Написание тестов на функциональность;  * Оптимизация производительности по результатам НТ;  * Review кода (PR).**Нам важно:**  * Опыт коммерческой разработки на PL/SQL от 3-х лет;  * Наличие опыта разработки систем работающих с базами данных и самих баз данных (Oracle, MS SQL, Postgres, MySQL, DB2 и др.);  * Наличие опыта разработки на языках общего назначения (С, С++, Java, Go, RUST, PHP, JavaScript и т.д.). Особенно Java, такие кандидаты смогут выполнять намного больше задач у нас.**Мы предлагаем:**  * Оформление полностью по ТК РФ;  * ДМС после успешного прохождения испытательного срока;  * Дополнительный оплачиваемый отпуск при значимых событиях в жизни;  * Корпоративный английский;  * Отсутствие дресс-кода;  * Гибкое начало рабочего дня, график 5/2.",,2022-01-13T11:19:20.992+03:00,АЙФЭЛЛ,REMOTE,False
